{
  "format": "lic-dsf-scenario-v1",
  "workbook_sha256": "3a0a0b80c7cbc95ac953f25ecae0b437129d669ceb8aeefb54ab86dc8727ea86",
  "input_years": [
    2024,
    2025,
    2026,
    2027,
    2028,
    2029,
    2030,
    2031,
    2032,
    2033,
    2034,
    2035,
    2036,
    2037,
    2038,
    2039,
    2040,
    2041,
    2042,
    2043,
    2044
  ],
  "definition": {
    "delta_paths": {
      "11": [
        0.0,
        0.0,
        0.0,
        0.0,
        0.0,
        0.0,
        -9.686326116843669e-05,
        -0.00014487229201386176,
        -0.0001626932532702713,
        -0.00016226284825372056,
        -0.00015179381852720164,
        -0.00011361582106898457,
        -8.50077662781154e-05,
        -6.359958581693241e-05,
        -4.755851297293459e-05,
        -3.5565347720674725e-05,
        -2.660031857729464e-05,
        -1.9887054508805138e-05,
        -1.4869358205386613e-05,
        -1.1146253996758594e-05,
        -8.340935850186968e-06
      ],
      "13": [
        0.0,
        0.0,
        0.0,
        0.5,
        0.5,
        0.5,
        0.033700267700389475,
        0.016890212592350906,
        -0.00031611969448519517,
        -0.016862808459041645,
        -0.03365957933312558,
        -0.03378894128494281,
        -0.033476521556952576,
        -0.03319776187771595,
        -0.03294432309770556,
        -0.032806175523607095,
        -0.03226189250358047,
        -0.032254289017949134,
        -0.03182822727344714,
        -0.031461254125606075,
        -0.03113460428194159
      ],
      "15": [
        0.0,
        0.0,
        0.0,
        0.0,
        0.0,
        0.0,
        -9.686326116843669e-05,
        -0.00014487229201386176,
        -0.0001626932532702713,
        -0.00016226284825372056,
        -0.00015179381852720164,
        -0.00011361582106898457,
        -8.50077662781154e-05,
        -6.359958581693241e-05,
        -4.755851297293459e-05,
        -3.5565347720674725e-05,
        -2.660031857729464e-05,
        -1.9887054508805138e-05,
        -1.4869358205386613e-05,
        -1.1146253996758594e-05,
        -8.340935850186968e-06
      ],
      "17": [
        0.0,
        0.0,
        0.0,
        0.0,
        0.0,
        0.0,
        0.0,
        0.0,
        0.0,
        0.0,
        0.0,
        0.0,
        0.0,
        0.0,
        0.0,
        0.0,
        0.0,
        0.0,
        0.0,
        0.0,
        0.0
      ],
      "20": [
        0.0,
        0.0,
        0.0,
        0.0,
        0.0,
        0.0,
        0.1,
        0.1,
        0.1,
        0.1,
        0.1,
        0.0,
        0.0,
        0.0,
        0.0,
        0.0,
        0.0,
        0.0,
        0.0,
        0.0,
        0.0
      ],
      "22": [
        0.0,
        0.0,
        0.0,
        0.0,
        0.0,
        0.0,
        0.0,
        0.0,
        0.0,
        0.0,
        0.0,
        0.0,
        0.0,
        0.0,
        0.0,
        0.0,
        0.0,
        0.0,
        0.0,
        0.0,
        0.0
      ],
      "24": [
        0.0,
        0.0,
        0.0,
        0.0,
        0.0,
        0.0,
        0.0,
        0.0,
        0.0,
        0.0,
        0.0,
        0.0,
        0.0,
        0.0,
        0.0,
        0.0,
        0.0,
        0.0,
        0.0,
        0.0,
        0.0
      ],
      "28": [
        0.0,
        0.0,
        0.0,
        0.0,
        0.0,
        0.0,
        0.0,
        0.0,
        0.0,
        0.0,
        0.0,
        0.0,
        0.0,
        0.0,
        0.0,
        0.0,
        0.0,
        0.0,
        0.0,
        0.0,
        0.0
      ],
      "30": [
        0.0,
        0.0,
        0.0,
        0.2,
        0.2,
        0.2,
        0.0,
        0.0,
        0.0,
        0.0,
        0.0,
        0.0,
        0.0,
        0.0,
        0.0,
        0.0,
        0.0,
        0.0,
        0.0,
        0.0,
        0.0
      ],
      "32": [
        0.0,
        0.0,
        0.0,
        0.0,
        0.0,
        0.0,
        0.0,
        0.0,
        0.0,
        0.0,
        0.0,
        0.0,
        0.0,
        0.0,
        0.0,
        0.0,
        0.0,
        0.0,
        0.0,
        0.0,
        0.0
      ],
      "34": [
        0.0,
        0.0,
        0.0,
        0.0,
        0.0,
        0.0,
        0.0,
        0.0,
        0.0,
        0.0,
        0.0,
        0.0,
        0.0,
        0.0,
        0.0,
        0.0,
        0.0,
        0.0,
        0.0,
        0.0,
        0.0
      ],
      "36": [
        0.0,
        0.0,
        0.0,
        0.0,
        0.0,
        0.0,
        0.0,
        0.0,
        0.0,
        0.0,
        0.0,
        0.0,
        0.0,
        0.0,
        0.0,
        0.0,
        0.0,
        0.0,
        0.0,
        0.0,
        0.0
      ],
      "38": [
        0.0,
        0.0,
        0.0,
        0.0,
        0.0,
        0.0,
        0.0,
        0.0,
        0.0,
        0.0,
        0.0,
        0.0,
        0.0,
        0.0,
        0.0,
        0.0,
        0.0,
        0.0,
        0.0,
        0.0,
        0.0
      ]
    },
    "terms": {
      "rate": 0.08,
      "grace_years": 4.0,
      "maturity_years": 9.0
    }
  },
  "share_label": "Smaller assumed benefit",
  "shared_rationale": {
    "financing": "Illustrative assumptions, not a financing offer. Common supported external terms: 8% interest, 4-year grace and 9-year maturity. Held constant across this case set; this comparison does not test alternative financing.",
    "20": "Illustrative assumed growth increment of 0.1 percentage points in 2030–2034, zero elsewhere. This is not a calibrated investment effect or forecast. When growth returns to baseline, the higher GDP level persists in the assumption. Spending and grant-ratio paths were jointly mapped to this growth path; editing growth alone does not preserve that fiscal interpretation. Use the complete alternative case or remap the linked paths.",
    "13": "Illustrative investment costs 0.5% of each year’s baseline GDP in 2027–2029, followed by 0.05% maintenance annually 2030–2044. Other primary spending retains its already-planned baseline level; it is not reduced below that path. Lower ratios reflect the larger GDP denominator. This does not establish service quality or spending per person. Figures entered here are the complete mapped ratio adjustments, including the investment. Interest is not part of primary spending.",
    "11": "Revenue excluding grants retains its baseline GDP share. Existing grants retain baseline nominal amounts, so the matching adjustment to revenue-and-grants avoids inventing new grant funding. Additional non-grant receipts from higher output are assumed, not independently modelled. Statutory tax rates are not identified.",
    "15": "Existing grants remain at their baseline nominal amounts. Their GDP share falls when the assumed GDP level rises. The same share adjustment is included in revenue-and-grants to preserve the non-grant revenue share. No additional grant finance is assumed.",
    "30": "Imported inputs amount to 0.2% of each year’s baseline GDP in 2027–2029, within the 0.5% investment cost, not an additional fiscal cost. Other imports retain their baseline GDP share. This is a simplified illustrative external-response assumption."
  }
}
